{"schemaVersion":1,"firmwareVersion":"1.1.4","buildId":"17b7b4756043c19d939ffa446eb7431c6e4832ac","buildNumber":1233,"target":"esp32-s3-n16r8","image":{"url":"/firmware/releases/1.1.4/17b7b4756043c19d939ffa446eb7431c6e4832ac/lightweaver-controller-esp32s3-app.bin","size":2086976,"sha256":"88888040009c1d95e928016540bc4d46a976d180bb752a908dc114eca06c106b"},"partition":{"layout":"default_16MB.csv","tableSha256":"9af3af2b74e944337ba85f2b0027ee80df160579a1ab746ba0f95853f618cd60","app0Offset":65536,"app1Offset":6619136,"slotSize":6553600},"compatibility":{"firmwareApiMin":2,"firmwareApiMax":2,"projectSchemaMin":3,"projectSchemaMax":3,"minimumUpdaterVersion":1,"minimumBootstrapBuild":1198},"preservation":{"dataPartitionsIncluded":false}}