{"schemaVersion":1,"firmwareVersion":"1.1.26","buildId":"241c5cb6d59df0bf44f7db87cda292bbccd14c93","buildNumber":1384,"target":"esp32-s3-n16r8","image":{"url":"/firmware/releases/1.1.26/241c5cb6d59df0bf44f7db87cda292bbccd14c93/lightweaver-controller-esp32s3-app.bin","size":2116688,"sha256":"4133073a958583872d7bc6e4c84c409d0ba962164cb547bc758a6e413302179f"},"partition":{"layout":"default_16MB.csv","tableSha256":"9af3af2b74e944337ba85f2b0027ee80df160579a1ab746ba0f95853f618cd60","app0Offset":65536,"app1Offset":6619136,"slotSize":6553600},"compatibility":{"firmwareApiMin":2,"firmwareApiMax":2,"projectSchemaMin":3,"projectSchemaMax":3,"minimumUpdaterVersion":1,"minimumBootstrapBuild":1198},"preservation":{"dataPartitionsIncluded":false}}