{"schemaVersion":1,"firmwareVersion":"1.1.17","buildId":"a4979555b4757e7617e8fdb30d41790e8a805689","buildNumber":1319,"target":"esp32-s3-n16r8","image":{"url":"/firmware/releases/1.1.17/a4979555b4757e7617e8fdb30d41790e8a805689/lightweaver-controller-esp32s3-app.bin","size":2113328,"sha256":"0ab255572622f355bb6e4328e4f0dcc384bc812052d7536faf98693183f947e6"},"partition":{"layout":"default_16MB.csv","tableSha256":"9af3af2b74e944337ba85f2b0027ee80df160579a1ab746ba0f95853f618cd60","app0Offset":65536,"app1Offset":6619136,"slotSize":6553600},"compatibility":{"firmwareApiMin":2,"firmwareApiMax":2,"projectSchemaMin":3,"projectSchemaMax":3,"minimumUpdaterVersion":1,"minimumBootstrapBuild":1198},"preservation":{"dataPartitionsIncluded":false}}