{"schemaVersion":1,"firmwareVersion":"1.1.20","buildId":"645488e6cbb4292d48d6653ee1e4f7c4938e75de","buildNumber":1326,"target":"esp32-s3-n16r8","image":{"url":"/firmware/releases/1.1.20/645488e6cbb4292d48d6653ee1e4f7c4938e75de/lightweaver-controller-esp32s3-app.bin","size":2113408,"sha256":"af481908eebd9d698bc0e2de407e2af326c96e9bba1a8f785dcf04c341312920"},"partition":{"layout":"default_16MB.csv","tableSha256":"9af3af2b74e944337ba85f2b0027ee80df160579a1ab746ba0f95853f618cd60","app0Offset":65536,"app1Offset":6619136,"slotSize":6553600},"compatibility":{"firmwareApiMin":2,"firmwareApiMax":2,"projectSchemaMin":3,"projectSchemaMax":3,"minimumUpdaterVersion":1,"minimumBootstrapBuild":1198},"preservation":{"dataPartitionsIncluded":false}}