{"schemaVersion":1,"firmwareVersion":"1.1.11","buildId":"eb7617f55bd9e4c39f08d143bd3d842264ea665d","buildNumber":1273,"target":"esp32-s3-n16r8","image":{"url":"/firmware/releases/1.1.11/eb7617f55bd9e4c39f08d143bd3d842264ea665d/lightweaver-controller-esp32s3-app.bin","size":2096144,"sha256":"b236e8a12c9c282e2803fd58979d669aded199bcf1a25fde29a6600c5d6c73bb"},"partition":{"layout":"default_16MB.csv","tableSha256":"9af3af2b74e944337ba85f2b0027ee80df160579a1ab746ba0f95853f618cd60","app0Offset":65536,"app1Offset":6619136,"slotSize":6553600},"compatibility":{"firmwareApiMin":2,"firmwareApiMax":2,"projectSchemaMin":3,"projectSchemaMax":3,"minimumUpdaterVersion":1,"minimumBootstrapBuild":1198},"preservation":{"dataPartitionsIncluded":false}}