{"schemaVersion":1,"firmwareVersion":"1.1.12","buildId":"18e968cd732a7a7d9fb0cc46d6b20b89ad8133b0","buildNumber":1280,"target":"esp32-s3-n16r8","image":{"url":"/firmware/releases/1.1.12/18e968cd732a7a7d9fb0cc46d6b20b89ad8133b0/lightweaver-controller-esp32s3-app.bin","size":2096512,"sha256":"4b256d73542b4b0c53719c59f9f901381f938c6f47635b87dc171a19ec744b30"},"partition":{"layout":"default_16MB.csv","tableSha256":"9af3af2b74e944337ba85f2b0027ee80df160579a1ab746ba0f95853f618cd60","app0Offset":65536,"app1Offset":6619136,"slotSize":6553600},"compatibility":{"firmwareApiMin":2,"firmwareApiMax":2,"projectSchemaMin":3,"projectSchemaMax":3,"minimumUpdaterVersion":1,"minimumBootstrapBuild":1198},"preservation":{"dataPartitionsIncluded":false}}