{"schemaVersion":1,"firmwareVersion":"1.1.22","buildId":"d12236b0aceb6459f8aabed361a7bf7cf37fadc6","buildNumber":1340,"target":"esp32-s3-n16r8","image":{"url":"/firmware/releases/1.1.22/d12236b0aceb6459f8aabed361a7bf7cf37fadc6/lightweaver-controller-esp32s3-app.bin","size":2114064,"sha256":"3cb4029ffdab9760f9a64b7172516b84828ed60126f719753c597327e7950843"},"partition":{"layout":"default_16MB.csv","tableSha256":"9af3af2b74e944337ba85f2b0027ee80df160579a1ab746ba0f95853f618cd60","app0Offset":65536,"app1Offset":6619136,"slotSize":6553600},"compatibility":{"firmwareApiMin":2,"firmwareApiMax":2,"projectSchemaMin":3,"projectSchemaMax":3,"minimumUpdaterVersion":1,"minimumBootstrapBuild":1198},"preservation":{"dataPartitionsIncluded":false}}