{"schemaVersion":1,"firmwareVersion":"1.1.6","buildId":"a2c24fa95517d680e2d002d02c04b3828db5db04","buildNumber":1244,"target":"esp32-s3-n16r8","image":{"url":"/firmware/releases/1.1.6/a2c24fa95517d680e2d002d02c04b3828db5db04/lightweaver-controller-esp32s3-app.bin","size":2087184,"sha256":"21215c629f0b84f84960dcee691c57c103b44b2766b23c33fca02e3f6a68a8cd"},"partition":{"layout":"default_16MB.csv","tableSha256":"9af3af2b74e944337ba85f2b0027ee80df160579a1ab746ba0f95853f618cd60","app0Offset":65536,"app1Offset":6619136,"slotSize":6553600},"compatibility":{"firmwareApiMin":2,"firmwareApiMax":2,"projectSchemaMin":3,"projectSchemaMax":3,"minimumUpdaterVersion":1,"minimumBootstrapBuild":1198},"preservation":{"dataPartitionsIncluded":false}}