{"schemaVersion":1,"firmwareVersion":"1.1.5","buildId":"faa1ff3c9d738705fd8bbb5e2c42d85ff1fb7ca4","buildNumber":1239,"target":"esp32-s3-n16r8","image":{"url":"/firmware/releases/1.1.5/faa1ff3c9d738705fd8bbb5e2c42d85ff1fb7ca4/lightweaver-controller-esp32s3-app.bin","size":2087248,"sha256":"d5a39cda702759fb9922f036b8b0bcd2d97e838d929dcfe21f837355ffdea805"},"partition":{"layout":"default_16MB.csv","tableSha256":"9af3af2b74e944337ba85f2b0027ee80df160579a1ab746ba0f95853f618cd60","app0Offset":65536,"app1Offset":6619136,"slotSize":6553600},"compatibility":{"firmwareApiMin":2,"firmwareApiMax":2,"projectSchemaMin":3,"projectSchemaMax":3,"minimumUpdaterVersion":1,"minimumBootstrapBuild":1198},"preservation":{"dataPartitionsIncluded":false}}