{"schemaVersion":1,"firmwareVersion":"1.1.15","buildId":"947faa37ea01d2a4e0efc7d052394e29984083cd","buildNumber":1306,"target":"esp32-s3-n16r8","image":{"url":"/firmware/releases/1.1.15/947faa37ea01d2a4e0efc7d052394e29984083cd/lightweaver-controller-esp32s3-app.bin","size":2111168,"sha256":"a866c0fe087c47e0bf4e4eb3a81e108c9c07678aa5e8b6c1a909cdac56fb625c"},"partition":{"layout":"default_16MB.csv","tableSha256":"9af3af2b74e944337ba85f2b0027ee80df160579a1ab746ba0f95853f618cd60","app0Offset":65536,"app1Offset":6619136,"slotSize":6553600},"compatibility":{"firmwareApiMin":2,"firmwareApiMax":2,"projectSchemaMin":3,"projectSchemaMax":3,"minimumUpdaterVersion":1,"minimumBootstrapBuild":1198},"preservation":{"dataPartitionsIncluded":false}}