{"schemaVersion":1,"firmwareVersion":"1.1.29","buildId":"fb42cc263bba6f18ab580d10baa16ca87d47dc48","buildNumber":1427,"target":"esp32-s3-n16r8","image":{"url":"/firmware/releases/1.1.29/fb42cc263bba6f18ab580d10baa16ca87d47dc48/lightweaver-controller-esp32s3-app.bin","size":2147776,"sha256":"bd94583352266794aca13d366d0386891447398277279c738c1548cc01835cb7"},"partition":{"layout":"default_16MB.csv","tableSha256":"9af3af2b74e944337ba85f2b0027ee80df160579a1ab746ba0f95853f618cd60","app0Offset":65536,"app1Offset":6619136,"slotSize":6553600},"compatibility":{"firmwareApiMin":2,"firmwareApiMax":2,"projectSchemaMin":3,"projectSchemaMax":3,"minimumUpdaterVersion":1,"minimumBootstrapBuild":1198},"preservation":{"dataPartitionsIncluded":false}}