{"schemaVersion":1,"firmwareVersion":"1.1.14","buildId":"8a87e0097575060ae73a3a33cad2218160f21303","buildNumber":1301,"target":"esp32-s3-n16r8","image":{"url":"/firmware/releases/1.1.14/8a87e0097575060ae73a3a33cad2218160f21303/lightweaver-controller-esp32s3-app.bin","size":2110864,"sha256":"291c716482f75328d28f95fb29da369ea3466ea4bb7b82faaa4b2a47805ceb8b"},"partition":{"layout":"default_16MB.csv","tableSha256":"9af3af2b74e944337ba85f2b0027ee80df160579a1ab746ba0f95853f618cd60","app0Offset":65536,"app1Offset":6619136,"slotSize":6553600},"compatibility":{"firmwareApiMin":2,"firmwareApiMax":2,"projectSchemaMin":3,"projectSchemaMax":3,"minimumUpdaterVersion":1,"minimumBootstrapBuild":1198},"preservation":{"dataPartitionsIncluded":false}}