{"schemaVersion":1,"firmwareVersion":"1.1.19","buildId":"884f19c6f1a9aa833bc37d7dcc2e2291b0155c12","buildNumber":1324,"target":"esp32-s3-n16r8","image":{"url":"/firmware/releases/1.1.19/884f19c6f1a9aa833bc37d7dcc2e2291b0155c12/lightweaver-controller-esp32s3-app.bin","size":2113440,"sha256":"0c77c754b71f22a0299e07fbdcd8917dbce31cb4984bfe83448d0d2d6224236b"},"partition":{"layout":"default_16MB.csv","tableSha256":"9af3af2b74e944337ba85f2b0027ee80df160579a1ab746ba0f95853f618cd60","app0Offset":65536,"app1Offset":6619136,"slotSize":6553600},"compatibility":{"firmwareApiMin":2,"firmwareApiMax":2,"projectSchemaMin":3,"projectSchemaMax":3,"minimumUpdaterVersion":1,"minimumBootstrapBuild":1198},"preservation":{"dataPartitionsIncluded":false}}