{"schemaVersion":1,"firmwareVersion":"1.1.27","buildId":"46813a0d655a212bb77b9b13fde1a6c675923ac9","buildNumber":1392,"target":"esp32-s3-n16r8","image":{"url":"/firmware/releases/1.1.27/46813a0d655a212bb77b9b13fde1a6c675923ac9/lightweaver-controller-esp32s3-app.bin","size":2118464,"sha256":"e666234a840b3bec3f6e164100858af015ba192f1512cda192517d1d3ed0c194"},"partition":{"layout":"default_16MB.csv","tableSha256":"9af3af2b74e944337ba85f2b0027ee80df160579a1ab746ba0f95853f618cd60","app0Offset":65536,"app1Offset":6619136,"slotSize":6553600},"compatibility":{"firmwareApiMin":2,"firmwareApiMax":2,"projectSchemaMin":3,"projectSchemaMax":3,"minimumUpdaterVersion":1,"minimumBootstrapBuild":1198},"preservation":{"dataPartitionsIncluded":false}}