{"schemaVersion":1,"firmwareVersion":"1.1.16","buildId":"967f89382ab2bb04910787384cbf0ec252cb38fd","buildNumber":1316,"target":"esp32-s3-n16r8","image":{"url":"/firmware/releases/1.1.16/967f89382ab2bb04910787384cbf0ec252cb38fd/lightweaver-controller-esp32s3-app.bin","size":2113664,"sha256":"acf8e145de6ea7abdcbf6eb068492224489b95c25552d38ee52c84a82222b1b4"},"partition":{"layout":"default_16MB.csv","tableSha256":"9af3af2b74e944337ba85f2b0027ee80df160579a1ab746ba0f95853f618cd60","app0Offset":65536,"app1Offset":6619136,"slotSize":6553600},"compatibility":{"firmwareApiMin":2,"firmwareApiMax":2,"projectSchemaMin":3,"projectSchemaMax":3,"minimumUpdaterVersion":1,"minimumBootstrapBuild":1198},"preservation":{"dataPartitionsIncluded":false}}