{"schemaVersion":1,"firmwareVersion":"1.1.25","buildId":"1f59ae0480d5aa1bd0548f3c04239920973accd8","buildNumber":1365,"target":"esp32-s3-n16r8","image":{"url":"/firmware/releases/1.1.25/1f59ae0480d5aa1bd0548f3c04239920973accd8/lightweaver-controller-esp32s3-app.bin","size":2114448,"sha256":"adcf9f904594831a398bf44426877e160a3d4f488d5fc637cebf2a3c4059581a"},"partition":{"layout":"default_16MB.csv","tableSha256":"9af3af2b74e944337ba85f2b0027ee80df160579a1ab746ba0f95853f618cd60","app0Offset":65536,"app1Offset":6619136,"slotSize":6553600},"compatibility":{"firmwareApiMin":2,"firmwareApiMax":2,"projectSchemaMin":3,"projectSchemaMax":3,"minimumUpdaterVersion":1,"minimumBootstrapBuild":1198},"preservation":{"dataPartitionsIncluded":false}}