{"schemaVersion":1,"firmwareVersion":"1.1.7","buildId":"1f9a44b855ff7e08dfe6813ed7bac5c7cfd7bbe5","buildNumber":1250,"target":"esp32-s3-n16r8","image":{"url":"/firmware/releases/1.1.7/1f9a44b855ff7e08dfe6813ed7bac5c7cfd7bbe5/lightweaver-controller-esp32s3-app.bin","size":2087072,"sha256":"a92ef60ed7c9c34d9f3375116c68bd688f5a67ed7d903e0ce5d20d08ab6ebe2c"},"partition":{"layout":"default_16MB.csv","tableSha256":"9af3af2b74e944337ba85f2b0027ee80df160579a1ab746ba0f95853f618cd60","app0Offset":65536,"app1Offset":6619136,"slotSize":6553600},"compatibility":{"firmwareApiMin":2,"firmwareApiMax":2,"projectSchemaMin":3,"projectSchemaMax":3,"minimumUpdaterVersion":1,"minimumBootstrapBuild":1198},"preservation":{"dataPartitionsIncluded":false}}