{"schemaVersion":1,"firmwareVersion":"1.1.8","buildId":"b459873c3fde9549e788d3c271b3a6fb173c4bdd","buildNumber":1252,"target":"esp32-s3-n16r8","image":{"url":"/firmware/releases/1.1.8/b459873c3fde9549e788d3c271b3a6fb173c4bdd/lightweaver-controller-esp32s3-app.bin","size":2088336,"sha256":"42a849ef1cfe90b85d8eb86660010e8bebe3586a7ea185f448edeb534b501a0f"},"partition":{"layout":"default_16MB.csv","tableSha256":"9af3af2b74e944337ba85f2b0027ee80df160579a1ab746ba0f95853f618cd60","app0Offset":65536,"app1Offset":6619136,"slotSize":6553600},"compatibility":{"firmwareApiMin":2,"firmwareApiMax":2,"projectSchemaMin":3,"projectSchemaMax":3,"minimumUpdaterVersion":1,"minimumBootstrapBuild":1198},"preservation":{"dataPartitionsIncluded":false}}