{"schemaVersion":1,"firmwareVersion":"1.1.21","buildId":"70bc9b267a84dc97f5852562fca28b3e8a9c58ec","buildNumber":1337,"target":"esp32-s3-n16r8","image":{"url":"/firmware/releases/1.1.21/70bc9b267a84dc97f5852562fca28b3e8a9c58ec/lightweaver-controller-esp32s3-app.bin","size":2114192,"sha256":"1cf21bf88827e58de1aa9fdac22aa72bfc34349b92eefc9c9f4a1a5c5fc65350"},"partition":{"layout":"default_16MB.csv","tableSha256":"9af3af2b74e944337ba85f2b0027ee80df160579a1ab746ba0f95853f618cd60","app0Offset":65536,"app1Offset":6619136,"slotSize":6553600},"compatibility":{"firmwareApiMin":2,"firmwareApiMax":2,"projectSchemaMin":3,"projectSchemaMax":3,"minimumUpdaterVersion":1,"minimumBootstrapBuild":1198},"preservation":{"dataPartitionsIncluded":false}}