{"schemaVersion":1,"firmwareVersion":"1.1.9","buildId":"c682375ade1b0aa7d2bda4b800057e09dc098b0d","buildNumber":1254,"target":"esp32-s3-n16r8","image":{"url":"/firmware/releases/1.1.9/c682375ade1b0aa7d2bda4b800057e09dc098b0d/lightweaver-controller-esp32s3-app.bin","size":2091360,"sha256":"6e8ab28a396608e60cde93d931dd083447db916f258fca2fe064a30128a793b6"},"partition":{"layout":"default_16MB.csv","tableSha256":"9af3af2b74e944337ba85f2b0027ee80df160579a1ab746ba0f95853f618cd60","app0Offset":65536,"app1Offset":6619136,"slotSize":6553600},"compatibility":{"firmwareApiMin":2,"firmwareApiMax":2,"projectSchemaMin":3,"projectSchemaMax":3,"minimumUpdaterVersion":1,"minimumBootstrapBuild":1198},"preservation":{"dataPartitionsIncluded":false}}