{"schemaVersion":1,"firmwareVersion":"1.1.23","buildId":"b37685320d225f7b0f01584ce001d1141538d4b2","buildNumber":1345,"target":"esp32-s3-n16r8","image":{"url":"/firmware/releases/1.1.23/b37685320d225f7b0f01584ce001d1141538d4b2/lightweaver-controller-esp32s3-app.bin","size":2114080,"sha256":"8eddaf631a00568b211f1007afaae30e56265d52195dace017dd570221045c56"},"partition":{"layout":"default_16MB.csv","tableSha256":"9af3af2b74e944337ba85f2b0027ee80df160579a1ab746ba0f95853f618cd60","app0Offset":65536,"app1Offset":6619136,"slotSize":6553600},"compatibility":{"firmwareApiMin":2,"firmwareApiMax":2,"projectSchemaMin":3,"projectSchemaMax":3,"minimumUpdaterVersion":1,"minimumBootstrapBuild":1198},"preservation":{"dataPartitionsIncluded":false}}