{"schemaVersion":1,"firmwareVersion":"1.1.24","buildId":"bb77bfe8d37d6f86f42e393288de042e949dbf6e","buildNumber":1360,"target":"esp32-s3-n16r8","image":{"url":"/firmware/releases/1.1.24/bb77bfe8d37d6f86f42e393288de042e949dbf6e/lightweaver-controller-esp32s3-app.bin","size":2114192,"sha256":"ef61a08f9bc0ef5cd0088a57f4f51a7cd49f588014adf5a6261762e4b349cd90"},"partition":{"layout":"default_16MB.csv","tableSha256":"9af3af2b74e944337ba85f2b0027ee80df160579a1ab746ba0f95853f618cd60","app0Offset":65536,"app1Offset":6619136,"slotSize":6553600},"compatibility":{"firmwareApiMin":2,"firmwareApiMax":2,"projectSchemaMin":3,"projectSchemaMax":3,"minimumUpdaterVersion":1,"minimumBootstrapBuild":1198},"preservation":{"dataPartitionsIncluded":false}}