{"schemaVersion":1,"firmwareVersion":"1.1.10","buildId":"cae0e3c65762db93511e2bbc3c6ae1a3ac0e8e81","buildNumber":1266,"target":"esp32-s3-n16r8","image":{"url":"/firmware/releases/1.1.10/cae0e3c65762db93511e2bbc3c6ae1a3ac0e8e81/lightweaver-controller-esp32s3-app.bin","size":2092208,"sha256":"d18fea4f9e0162362ab0abb19ad5cfe8fd45c93e93381c680ae1fffea1bd7909"},"partition":{"layout":"default_16MB.csv","tableSha256":"9af3af2b74e944337ba85f2b0027ee80df160579a1ab746ba0f95853f618cd60","app0Offset":65536,"app1Offset":6619136,"slotSize":6553600},"compatibility":{"firmwareApiMin":2,"firmwareApiMax":2,"projectSchemaMin":3,"projectSchemaMax":3,"minimumUpdaterVersion":1,"minimumBootstrapBuild":1198},"preservation":{"dataPartitionsIncluded":false}}