{"schemaVersion":1,"firmwareVersion":"1.1.28","buildId":"e606072e13f99a331d001aba663b993937fd842c","buildNumber":1418,"target":"esp32-s3-n16r8","image":{"url":"/firmware/releases/1.1.28/e606072e13f99a331d001aba663b993937fd842c/lightweaver-controller-esp32s3-app.bin","size":2127088,"sha256":"32194b4733fb65b1f4b7117cf5de45c9436dbe3bf2b1b79fcde45edb38fce2c6"},"partition":{"layout":"default_16MB.csv","tableSha256":"9af3af2b74e944337ba85f2b0027ee80df160579a1ab746ba0f95853f618cd60","app0Offset":65536,"app1Offset":6619136,"slotSize":6553600},"compatibility":{"firmwareApiMin":2,"firmwareApiMax":2,"projectSchemaMin":3,"projectSchemaMax":3,"minimumUpdaterVersion":1,"minimumBootstrapBuild":1198},"preservation":{"dataPartitionsIncluded":false}}